{
  "schemaVersion": "1.0.0",
  "id": "book.sun_moon",
  "slug": "sun-and-moon",
  "title": {
    "ko": "해님 달님",
    "en": "The Sun and the Moon",
    "romanization": "Haenim Dalnim"
  },
  "access": "free",
  "ageRange": "3-8",
  "estimatedMinutes": 12,
  "summary": "A suspenseful but gentle retelling of the Korean classic where two brave siblings notice a deceptive tiger, protect each other, and become remembered in the light of the sun and moon.",
  "sensitivityNotes": [
    "Gentle default version: Mother survives and the celestial ending is mythic and reassuring.",
    "Tiger is cunning, hungry, watchful, and dangerous through tone and framing, with no gore or graphic violence.",
    "Sibling bravery and clever caution are emphasized."
  ],
  "themes": [
    "bravery",
    "siblings",
    "family",
    "night sky"
  ],
  "characters": [
    "mother",
    "older_sibling",
    "younger_sibling",
    "tiger",
    "sky_spirit"
  ],
  "pages": [
    {
      "id": "sun_moon_001",
      "pageNumber": 1,
      "text": {
        "enLittle": "In a deep mountain village, two siblings helped Mother wrap warm rice cakes before market day.",
        "enStandard": "In a deep mountain village, two siblings helped Mother wrap warm rice cakes before market day. Steam curled around the room, and every cake smelled like home.",
        "koLittle": "깊은 산골 마을에 오누이가 어머니와 함께 따끈한 떡을 쌌어요.",
        "koStandard": "깊은 산골 마을에 오누이가 어머니와 함께 따끈한 떡을 쌌어요. 하얀 김이 방 안을 감싸고, 떡마다 집 냄새가 포근히 배었지요."
      },
      "koreanText": "깊은 산골 마을에 오누이가 어머니와 함께 따끈한 떡을 쌌어요. 하얀 김이 방 안을 감싸고, 떡마다 집 냄새가 포근히 배었지요.",
      "englishText": "In a deep mountain village, two siblings helped Mother wrap warm rice cakes before market day. Steam curled around the room, and every cake smelled like home.",
      "narrationScript": "깊은 산골 마을에 오누이가 어머니와 함께 따끈한 떡을 쌌어요. 하얀 김이 방 안을 감싸고, 떡마다 집 냄새가 포근히 배었지요.",
      "vocabulary": [
        {
          "ko": "오누이",
          "en": "brother and sister",
          "romanization": "onui",
          "definitionEn": "A brother and sister together.",
          "definitionKo": "남매나 누나와 남동생처럼 함께 있는 형제자매예요."
        },
        {
          "ko": "떡",
          "en": "rice cake",
          "romanization": "tteok",
          "definitionEn": "A soft Korean rice cake often shared at celebrations or markets.",
          "definitionKo": "쌀로 만든 말랑한 한국 음식이에요."
        }
      ],
      "storyBeat": {
        "purpose": "warmth",
        "emotion": "safe family warmth",
        "pageTurnHook": "Mother ties the basket and prepares to leave. The next page draws the tiger closer to the cottage lights.",
        "readAloudCue": "Read with suspenseful, brave, watchful, and child-safe; keep the tiger cunning, hungry, and deceptive without horror; keep pauses clear and musical. warm, slow opening; let the word warm linger",
        "childInteraction": "Tap the steam over the rice cakes."
      },
      "imagePrompt": "Cozy Korean mountain cottage at dawn, mother and two children in simple hanbok wrapping rice cakes, lantern glow, moon jar on shelf, distant pine forest outside window, no tiger visible yet Premium Korean watercolor, gouache, soft ink, hanji paper texture, child-safe ages 3-8, no text, no letters, no watermark.",
      "audioPrompt": "English-first warm professional picture-book narration with safe family warmth; Korean optional narration should sound natural, musical, and culturally grounded. Read-aloud cue: warm, slow opening; let the word warm linger",
      "animation": {
        "type": "warmLanternLoop",
        "loopDuration": 3.0,
        "motionSafety": "subtle only, no flashing",
        "layers": [
          {
            "name": "background",
            "motion": "none or very slow parallax",
            "intensity": "low",
            "outputFile": "assets/generated-draft/images/layers/sun-and-moon/sun_moon_001/background.png",
            "status": "generated_reviewed"
          },
          {
            "name": "midground",
            "motion": "subtle drift/sway where useful",
            "intensity": "low",
            "outputFile": "assets/generated-draft/images/layers/sun-and-moon/sun_moon_001/midground.png",
            "status": "generated_reviewed"
          },
          {
            "name": "character",
            "motion": "subtle breathing, blink, small gesture",
            "intensity": "low",
            "outputFile": "assets/generated-draft/images/layers/sun-and-moon/sun_moon_001/character.png",
            "status": "generated_reviewed"
          },
          {
            "name": "foreground",
            "motion": "tiny sway or none",
            "intensity": "low",
            "outputFile": "assets/generated-draft/images/layers/sun-and-moon/sun_moon_001/foreground.png",
            "status": "generated_reviewed"
          },
          {
            "name": "effect",
            "motion": "warmLanternLoop",
            "intensity": "low",
            "outputFile": "assets/generated-draft/images/layers/sun-and-moon/sun_moon_001/effect.png",
            "status": "generated_reviewed"
          },
          {
            "name": "particle_glow",
            "motion": "opacity pulse or slow particle drift",
            "intensity": "low",
            "outputFile": "assets/generated-draft/images/layers/sun-and-moon/sun_moon_001/particle-glow.png",
            "status": "generated_reviewed"
          }
        ]
      },
      "imageAsset": "assets/books/sun-and-moon/page-001.png",
      "imageSource": "assets/books/sun-and-moon/page-001.svg",
      "narrationAudio": "audio/synthetic-draft/narration/sun-and-moon/ko/page-001.wav",
      "ambientAudio": "audio/books/sun-and-moon/ambient/ambient-loop.wav",
      "imageAssetStatus": "placeholder",
      "characterBible": "characters/sun_moon.character_bible.json",
      "narrationAudioStatus": "synthetic_draft",
      "narrationVoice": "Grandma (Korean (South Korea))",
      "audioGenerationTool": "macos_say"
    },
    {
      "id": "sun_moon_002",
      "pageNumber": 2,
      "text": {
        "enLittle": "Mother lifted the basket onto her back.",
        "enStandard": "Mother lifted the basket onto her back. “Watch the house, and watch each other,” she said. The older sister nodded twice, and the younger brother nodded once more.",
        "koLittle": "어머니가 광주리를 등에 메며 말했어요.",
        "koStandard": "어머니가 광주리를 등에 메며 말했어요. “집도 잘 지키고, 서로도 잘 지키렴.” 누나는 두 번 고개를 끄덕였고, 동생은 한 번 더 크게 끄덕였어요."
      },
      "koreanText": "어머니가 광주리를 등에 메며 말했어요. “집도 잘 지키고, 서로도 잘 지키렴.” 누나는 두 번 고개를 끄덕였고, 동생은 한 번 더 크게 끄덕였어요.",
      "englishText": "Mother lifted the basket onto her back. “Watch the house, and watch each other,” she said. The older sister nodded twice, and the younger brother nodded once more.",
      "narrationScript": "어머니가 광주리를 등에 메며 말했어요. “집도 잘 지키고, 서로도 잘 지키렴.” 누나는 두 번 고개를 끄덕였고, 동생은 한 번 더 크게 끄덕였어요.",
      "vocabulary": [
        {
          "ko": "광주리",
          "en": "basket",
          "romanization": "gwangjuri",
          "definitionEn": "A woven basket for carrying food or tools.",
          "definitionKo": "음식이나 물건을 담아 나르는 바구니예요."
        },
        {
          "ko": "장날",
          "en": "market day",
          "romanization": "jangnal",
          "definitionEn": "A day when people gather to buy and sell food and goods.",
          "definitionKo": "사람들이 물건을 사고파는 장이 서는 날이에요."
        }
      ],
      "storyBeat": {
        "purpose": "promise",
        "emotion": "tender responsibility",
        "pageTurnHook": "The children are left with one important promise. The next page draws the tiger closer to the cottage lights.",
        "readAloudCue": "Read with suspenseful, brave, watchful, and child-safe; keep the tiger cunning, hungry, and deceptive without horror; keep pauses clear and musical. gentle but purposeful",
        "childInteraction": "Tap each child to hear the promise."
      },
      "imagePrompt": "Mother at cottage door with woven basket, older sister and younger brother standing seriously, morning light on paper windows, Korean rural cottage details Premium Korean watercolor, gouache, soft ink, hanji paper texture, child-safe ages 3-8, no text, no letters, no watermark.",
      "audioPrompt": "English-first warm professional picture-book narration with tender responsibility; Korean optional narration should sound natural, musical, and culturally grounded. Read-aloud cue: gentle but purposeful",
      "animation": {
        "type": "villageIntro",
        "loopDuration": 3.0,
        "motionSafety": "subtle only, no flashing",
        "layers": [
          {
            "name": "background",
            "motion": "none or very slow parallax",
            "intensity": "low",
            "outputFile": "assets/generated-draft/images/layers/sun-and-moon/sun_moon_002/background.png",
            "status": "generated_reviewed"
          },
          {
            "name": "midground",
            "motion": "subtle drift/sway where useful",
            "intensity": "low",
            "outputFile": "assets/generated-draft/images/layers/sun-and-moon/sun_moon_002/midground.png",
            "status": "generated_reviewed"
          },
          {
            "name": "character",
            "motion": "subtle breathing, blink, small gesture",
            "intensity": "low",
            "outputFile": "assets/generated-draft/images/layers/sun-and-moon/sun_moon_002/character.png",
            "status": "generated_reviewed"
          },
          {
            "name": "foreground",
            "motion": "tiny sway or none",
            "intensity": "low",
            "outputFile": "assets/generated-draft/images/layers/sun-and-moon/sun_moon_002/foreground.png",
            "status": "generated_reviewed"
          },
          {
            "name": "effect",
            "motion": "villageIntro",
            "intensity": "low",
            "outputFile": "assets/generated-draft/images/layers/sun-and-moon/sun_moon_002/effect.png",
            "status": "generated_reviewed"